Name,Description,Latitude,Longitude,InfoURL,ImageURL
UCSB,A great university located along the California coast!,34.416929,-119.845991,https://en.wikipedia.org/wiki/University_of_California,https://web.physics.ucsb.edu/~Women/images/ucsb-big.jpg
Buttermilk_Boulders,"A great place to climb, also part of native Paiute land.",37.334,-118.578,https://www.mountainproject.com/area/105876548/buttermilk-crags,https://cdn2.apstatic.com/photos/climb/107262742_medium_1494177133.jpg
Echo_Cliffs,Well-known sport climbing crag in the Santa Monica Mountains,34.112,-118.926,https://www.mountainproject.com/area/105825729/echo-cliffs,https://cdn2.apstatic.com/photos/climb/106372438_medium_1494102623.jpg
Malibu_Creek_State_Park,"An outdoor recreational area in southern California where people hike, climb, and bike",34.096,-118.731,https://www.mountainproject.com/area/105870845/malibu-creek-state-park,https://cdn2.apstatic.com/photos/climb/106691789_medium_1494132580.jpg
Mission_Gorge,Climbing crag located in central/eastern San Diego area,32.819,-117.056,https://www.mountainproject.com/area/105790250/mission-gorge,https://cdn2.apstatic.com/photos/climb/106893543_medium_1494149086.jpg
Lizards_Mouth,Popular hiking and climbing spot in the Santa Ynez Mountains,34.502,-119.866,https://www.mountainproject.com/area/105885134/the-lizards-mouth,https://cdn2.apstatic.com/photos/climb/111606040_medium_1494296739.jpg